{
  "format": 1,
  "base": {
    "digest": "sha256:5ec4b9b1f7c95a22f15707dcbcc9fc44b08a6267a0437d9d84536c5885de3c54",
    "size": 9
  },
  "result": {
    "digest": "sha256:0b7c6bd2d9cb71d4eb2a19342dca9d14cf90f7f4b7fc3752239638cbb1b9f616",
    "size": 9
  },
  "operations": [
    {
      "op": "copy",
      "offset": 0,
      "length": 2
    },
    {
      "op": "insert",
      "hex": "6e6577"
    },
    {
      "op": "copy",
      "offset": 5,
      "length": 4
    }
  ]
}
